URL,Title,Content,Image URLs,Tags,Comments
https://blog.naver.com/tablestorystudio/223666930153,여의도 맛집 서울 블루리본 장어덮밥 타마 스시 ps 포장,"사진 영상 글 @ 소일소이
지난 9월에 남편 생일 축하겸
제가 한턱 쏜다고
남편에게 먹고 싶은 걸 정하라고 했더니
장어덮밥 메뉴를 얘기하더라구요!
서울 장어덮밥 식당이 여러 군데 있긴 한데
그 중에서도 저희가 간 곳은
여의도 맛집으로 유명한 타마 스시
위치
[ 위치 ]
지하철 9호선 국회의사당역 3번 출구에서
10분 정도 걸어 중소기업중앙회 1층에 있어요.
토요일에 방문했었는데
여의도 맛집 건물에 웨딩홀이 있어서 그런지
사람들로 북적북적
플러스, 타마 스시 브레이크 시간이라
1층 한바퀴를 둘러보는데도
눈에 들어오질 않아서 한참 헤맸네요.
건물 후문으로 들어오면
카페 아티제 바로 맞은편,
이탈리안 레스토랑 ‘피오레’ 옆에 있어요.
영업시간 / 주차
[ 영업시간 ]
오픈 11:00 마감 21:30
라스트오더 20:30
브레이크 타임 14:30 - 17:00
[ 주차 ]
‘중소기업중앙회’ 건물 주차장
45분 무료 주차 가능
2013년부터 10년 연속
블루리본 서베이에 선정될 뿐만 아니라
현대카드 고메위크 최대 5년동안 선정된
서울 여의도 장어덮밥 맛집 타마 스시
블루리본 선정 맛집은 일단 믿음이 가서
남편이 검색해서 찾아냈을 때
바로 여기 가보자, 싶었답니다.
우리가 도착했을 땐 오후 3시반? 4시?
오후 5시까지 브레이크 타임이라
시간적 여유가 있어서
맞은편 카페 아티제에 있다가
4시 반쯤 대기하려고 식당 앞으로 갔어요.
그랬더니 벌써 앞에 대기 손님들이 꽤 있더라구요!
이럴 줄 알았으면 좀 일찍 나올걸..
그래도 다행히 4-5번째 순서로
첫 타임에 들어갈 수 있었어요!
우리 자리는 오픈형 키친 바로 옆
주말이었고, 대기 손님들이 많은 걸 대비해
프라이팬에 이미 조리된 장어가 가득하더라구요!
브레이크 타임에 다 준비해 놓으신 거 같아요.
여의도 맛집 메뉴 구성은
장어덮밥 단일 메뉴로
우리는 정식 2인, 에비스 생맥주 2잔
이렇게 주문했어요.
장어덮밥정식 58,000원
에비스 생맥주 15,000원
서울 장어덮밥 정식 코스에는
계란찜을 한 사람당 하나씩 내주시는데
새우랑 치즈가 토핑으로 올라간
정말 매끈한 일식 계란찜 스타일
그 외 싸먹을 수 있는 명란김, 감태김
그리고 생와사비가 나오고
함께 곁들여 먹기 좋은 기본찬으로
양파절임, 초생강, 산고추절임, 락교도 나와요.
확실히 장어덮밥만 계속 먹다보면
살짝 물리거나 질릴 수 있는데
절임류가 있어 좀 더 깔끔하더라구요~
그리고 내 입을 가장 산뜻하게 만들어 주는
에비스 생맥주 :)
차곡차곡 테이블엔 손님들로 채워가고
우리는 오매불망 여의도 맛집 메인 메뉴인
장어덮밥 기다리는 중
드디어 장어덮밥 도시락 배달
뚜껑을 덮은 상태로 놓아주시는데
뚜껑 열어 비쥬얼 보곤 심장이 둑흔둑흔
카페에서 커피도 괜히 마셨나?
후회 되더라구요 흑흑 ㅜㅜ
여의도 맛집 서울 블루리본 장어덮밥 타마 스시 ps 포장
재생
10
좋아요
0
00:11

여의도 맛집 서울 블루리본 장어덮밥 타마 스시 ps 포장
영상에서 느껴지는 지글지글 불향
도시락엔 장어가 3조각 정도?
도시락 크기가 꽤 큰 편인데
아래 밥이 보이지 않을 정도로 가득 채워주세요.
그리고 함께 제공되는 미소된장국
간단하게 팽이버섯과 대파만 들어가고
전체적으로 간이 슴슴하여
짭쪼름한 장어덮밥과 어울렸어요.
저는 주로 감태김에 밥 한 숟갈
생와사비 조금, 양파절임 얹어 싸먹었는데
감태김 특유의 달콤한 맛이 은은하게 올라오면서
바다향 가득 머금은 고소함이
또 너무 잘 어울렸어요.
다만? 명란김이나 감태김에 싸먹지 않고
그냥 장어덮밥만 먹었을 때
장어 비린내가 슬금슬금 올라오더라구요.
제가 그런 비린맛을 잘 못 느끼는 편인데
남편은 물론, 저도 느껴지는 비릿함에
솔직히 여의도 맛집 조금 실망하긴 했어요.
왜냐, 장어덮밥 정식 1인당 58,000원이면
결코 저렴한 편이 아니기에.
하지만 코스로 계란찜, 새우튀김,
녹차아이스크림 후식이 함께 나오고
도시락 크기, 장어덮밥 양을 감안하면
또 가격이 비싼건 아닌 것 같아요.
양이 얼마나 많았으면
배가 너무너무너무 터질 것 같아서
한끼 정도 먹을 수 있는 양은
포장해서 다음날 전자레인지에 데워 먹었답니다.
(다음날 데워 먹었더니 비릿함이 없었음)
식사 시간은 50분 정도?
맥주도 한 잔 해서 그런지 배가 더 불렀던 것 같아요.
다 먹고 나왔더니 아직도 대기 손님들이!
배가 부르다 못해 터지기 일보 직전이라
여의도 공원에서 산책했는데
데이트코스로 괜찮은 것 같아요.
남편이랑 매번 익숙하고 편한 곳만 가다보니
또 여의도는 오랜만이라
공원 산책만 하는데도 좋더라구요.
하지만 현실은 위장까지 다 내려놓고
잠깐 쉬고 싶은 상태.
저 헬륨가스기구 타고 집까지 가고 싶은
그런 상태...ㅋㅋㅋㅋ
다음엔 또 다른 맛집을 찾아서 뿅
50m
© NAVER Corp.
타마
서울특별시 영등포구 은행로 30 1층","https://postfiles.pstatic.net/MjAyNDExMjBfMjY0/MDAxNzMyMDU2NjU1NzUz.6xP_aPNoY2IRCXRpnxweTDt-RNnYsL2sl9ZBR_GIHdwg.ZYvmqMp3VGZz-wx7SITeIUw9CQTBj8rcr8gf5L57blIg.JPEG/SE-7221933E-6450-4C01-A917-B9A6B447A3EC.jpg?type=w966, https://postfiles.pstatic.net/MjAyNDExMjBfMjI3/MDAxNzMyMDU2NjU2OTM2.ryPpNsVhREkjCAQit3gAL1B4i_Fri2pFa3JQAxeaoBgg.O-T9o6_fRcVZz_Bx--EhR8WBrmAA9jeVowdgwnkExJ4g.JPEG/SE-3CB80BDC-4D4E-4062-A446-717D312F2970.jpg?type=w80_blur, https://postfiles.pstatic.net/MjAyNDExMjBfOTMg/MDAxNzMyMDU2NjU4MTAx.pa7UL-FVLdJCKHH1CbTavUuziUs01_F5LPV8L6kJFigg.g8gAfxG-GbRoBOfvWYhoqZLgBAYrWkWpLjhaLhVN1JMg.JPEG/SE-FB1CF989-B8E1-4749-85B9-5E6B1CDA04F8.jpg?type=w80_blur, https://postfiles.pstatic.net/MjAyNDExMjBfMTc4/MDAxNzMyMDU2NjU5MjU1.3GePsXLZdhDiFzZPTvknmwPqUXr5KpkDmelDq6yqQbYg.Bn4XukRromzTjPHaOFdxiNRoKmy-YCxo0PTVz88L9-0g.JPEG/SE-931AE890-055B-45DB-BCE7-CA2909AD6721.jpg?type=w80_blur, https://postfiles.pstatic.net/MjAyNDExMjBfMjUz/MDAxNzMyMDU2NjYwMzEx.ccld1RUdWdntsIbF8QNOAcTyD3yKSzT2HyhxKRc8PFcg.n37MM--TdqhK6X-HdaLa2_ljzmzyX7c72DuQot0RFG8g.JPEG/SE-BDD06591-DF5D-4EAA-9EE9-817144BE9A45.jpg?type=w80_blur, https://postfiles.pstatic.net/MjAyNDExMjBfMjA3/MDAxNzMyMDU2NjYxNDYx.rvB-bCsl_v4o5jVPoDYUD5DK8QuhKMrVjqqlo0KAxCgg.061iyJy19d7geoZ_WH2oibp7fwH3Wslgv75ie3CqaTEg.JPEG/SE-A782377C-8E39-486D-BA78-505869314038.jpg?type=w80_blur, https://postfiles.pstatic.net/MjAyNDExMjBfMTQ1/MDAxNzMyMDU2NjYyNjA1.fU5zX-RTW2zrIClDCno0JhIPgyJ-8RAxQMTHOh5KpBkg.XZbZtUXiS7PzLhr2gCd2Uw-b_a9KC2sHwUDc36ETGPgg.JPEG/SE-3F9A8C30-7F89-4378-8524-B9CCCA301522.jpg?type=w80_blur, https://postfiles.pstatic.net/MjAyNDExMjBfMjgz/MDAxNzMyMDU2NjYzOTc1.WLd1aCX0wRvjcdxfsbgzdHdoxFpTi0ZkFLZC5ppwGb8g.7bhwQhEWXZj1xcM1g4rQSxbJcc1DnCD4Bz3VrJOfbZEg.JPEG/SE-B3FD070C-82D4-422E-9983-E08778130022.jpg?type=w80_blur, https://postfiles.pstatic.net/MjAyNDExMjBfMTgg/MDAxNzMyMDU2NjY1Mzgy.oy78szUO-aNU2V9vTnxYWTcgUTHCTf8YRlkr_uEZhPkg.pU2iIZhlh0iUOdJGRyH-_k6P10V7s02tXG01Y3y7KOQg.JPEG/SE-99052DFB-1C37-4F36-94D1-690535C38703.jpg?type=w80_blur, https://postfiles.pstatic.net/MjAyNDExMjBfMjQz/MDAxNzMyMDU2NjY2MzU2.37qsRdOD5bNaKjHiNy52jXfM6VikL_ADHVk9vjBr7okg.9bqLy9eaF9GTAxbfvnc6DZIHJfmqZzkRZzYjYRW-k_cg.JPEG/SE-B4F218D2-108F-4D9C-A050-9F3AEE6E1C71.jpg?type=w80_blur, https://postfiles.pstatic.net/MjAyNDExMjBfMjk2/MDAxNzMyMDU2NjY3NTIy.JZWVRbpw4_6SEYMNbeyj0WG7oGamj7xy0HXae_B6O4Yg.hCUa_GJVaOQDZfFF8-cGB7VWdda_iw-k5VjBJIraGGIg.JPEG/SE-58E3E2C6-2AA7-4E0B-9615-CD807EA5869A.jpg?type=w80_blur, https://postfiles.pstatic.net/MjAyNDExMjBfMjY0/MDAxNzMyMDU2NjY5MTIz.ujfq_BK0v02Hhlnp8ZGlRGVCEh_VKJjvgHbLKIdOjysg.L-2J74JS4cryG_Xevdq-w5d1RaEuwR4BheWIFt_Ar50g.JPEG/SE-914E44E9-15D8-4024-BC39-00C003E5BA17.jpg?type=w80_blur, https://postfiles.pstatic.net/MjAyNDExMjBfMTg1/MDAxNzMyMDU2NjcwMzEw.rg7V27qsh8UK_tgww8Peo26Q5coGG-mdz7qdF7Y5LyMg.EAqurGr4pvaoIXncHU_C1WcDbA7VDq4Mw2bk4osC9Zsg.JPEG/SE-5D2C31EB-2012-46B8-87F8-670AD1448F67.jpg?type=w80_blur, https://postfiles.pstatic.net/MjAyNDExMjBfMjQw/MDAxNzMyMDU2NjcxNDUx.A0muzZ01Xtclryq89h2Ne7awnHCHM7aa2ai6CkllTN8g.vqZG9lrq4BEcQl3OUk-AejET6zIrZraaepEGYjic2Ugg.JPEG/SE-C4D47CA7-93E0-43C0-851D-F37B075583CE.jpg?type=w80_blur, https://postfiles.pstatic.net/MjAyNDExMjBfMTU4/MDAxNzMyMDU2NjcyNDUz.N9ntjKvQzcN-KuxGhRFS1ibr7cxeOQmtgduoho6xrcog.M-XTRCk1RFhHm8iu0iJ6GlZyqiJOZLrmKc5O6En4ZsAg.JPEG/SE-7D86B24D-64ED-4EDF-A4C8-441082E4C700.jpg?type=w80_blur, https://postfiles.pstatic.net/MjAyNDExMjBfMTQ1/MDAxNzMyMDU2NjczNTM5.yVav71Ai7qyu2Ku_WmKeq23xafP3FPHRUlGruTk1Ymcg.orxhNmPXdiluwdH9OPdf6xzmXsCcqrTo7XGEFqnnzjIg.JPEG/SE-F93FCE70-A588-4281-9354-13D7F7687AFA.jpg?type=w80_blur, https://postfiles.pstatic.net/MjAyNDExMjBfMjcy/MDAxNzMyMDU2Njc0NjY3.bsOmI2n83chbsiTSwsgn1sQGi03wdH6Z6iXbFQeGSyog.3B8FWExJVdP1ApLhjywPMlvBA5Pr_oApv1bS6z1pARAg.JPEG/SE-7483D9DE-65B3-4D9C-A56F-10121806E949.jpg?type=w80_blur, https://postfiles.pstatic.net/MjAyNDExMjBfMjYw/MDAxNzMyMDU2NjU0NjI5.PhaufIvXS6jFcQvtBBzJx30GARg7gGPxCvjrWCXH6k8g.xv_TUZnEMhmPZyva6Xv2e6qAgUq_IUCIMUnveZVBxsEg.JPEG/SE-53C2A080-57F6-4E17-9D79-AD193DF4B29B.jpg?type=w80_blur, https://postfiles.pstatic.net/MjAyNDExMjBfNTgg/MDAxNzMyMDU2Njc1NzAw.BiG_fbNuBp-uNJh16jVZDr2Gfv9y-97WFGSrYgP80iMg.glNOM0LNhuSsWmyHDfKfBM2S_nfvi-uLedwzQmXmkaQg.JPEG/SE-1473ABCE-18FC-4F52-AF23-63FF045FB316.jpg?type=w80_blur, https://postfiles.pstatic.net/MjAyNDExMjBfODMg/MDAxNzMyMDU2Njc2Nzk0.1VhHZynk_PacVlsDODC2vLnVr2ckF5Ml2itqzqwmqCYg.-UoOXFExqKLwUEn2-BGWUSJdi9fVrs9F-FOPLp6xMQsg.JPEG/SE-C3D6D87D-3675-46BF-9E13-A8266408C164.jpg?type=w80_blur, https://postfiles.pstatic.net/MjAyNDExMjBfMjQg/MDAxNzMyMDU2Njc3ODEw.DcQlGi4X4px1C0uEJdKTq9_uNLSs2P8OquztY4NppLIg.wka8ofMxUaRFN0IbD8XWYLCcsKZGnBtKuZrtnwv8VO4g.JPEG/SE-ADED76AA-CCD7-4680-BED9-A8165CB4389A.jpg?type=w80_blur, https://postfiles.pstatic.net/MjAyNDExMjBfMTk1/MDAxNzMyMDU2Njc5MjYz.QVbF0Corizbb1yzvXdRn7437fX1creE1MFcK5L4wb6Eg.k48QBLht6rmMkCAib87sgo5HTLkLZaQRungL7RLBAIgg.JPEG/SE-C4482627-F32E-4D87-B867-5CC38F2E469C.jpg?type=w80_blur, https://postfiles.pstatic.net/MjAyNDExMjBfMTA1/MDAxNzMyMDU2NjgwNTY0.2yzurpe7_DvYN1_rVkISjGUW8D8yjog7y55s3xv2ivcg.NZZoaUMDj2S-9j-GG0YS62is4kPtgsH6SlihRF8jfIkg.JPEG/SE-292CF0A2-57D2-4E22-A53A-60B90902AB7B.jpg?type=w80_blur, https://postfiles.pstatic.net/MjAyNDExMjBfNyAg/MDAxNzMyMDU2NjgxNTYx.ho7q5CKHCOM1JhZF9vIErFndAbFlC8FiN7yaV7o7w6cg.RTK0zuzoBtomAnkxw2TQSVS6mFN4cCWdqCChTDMGSP4g.JPEG/SE-AB812CAE-753D-4283-BEB7-0930DEA65C40.jpg?type=w80_blur",,
https://blog.naver.com/art2000umin,성수 건대 카페 추천 유럽 미술관에 온 것 같았던 카페 브루크,"성수동 의류샵에 볼일이 있어 갔다가 들렀던 예쁜 카페 브루크
티라미수와 콜드브루 커피 전문의 아담한 카페다
들어가자마자 중세 유럽을 연상케 하는 엔틱한 인테리어가 눈을 사로 잡았는데 입장료를 따로 내야 할 것만 같은 작은 미술관? 박물관 같은 느낌이 드는 특별한 카페였다
반가운 LP 플레이어도 있었는데 (옛날말로 전축)
보는 순간 갑자기 마음이 몽글몽글해 지고ㅠㅠ
이런 추억 돋는 소품 하나에도 눈물이 나는 나이가 되었나보다
웃어야할지 울어야할지 ㅋㅋㅋㅋ
카페 구석구석 사장님의 센스가 묻어나 있었는데
유럽에서 살다 오셨나 보다 내멋대로 추측해 보기
단출한 메뉴에서 이미 맛있음이 보인다
모든 커피의 베이스는 콜드브루~~~~👍👍👍
찐 커피 매니아인 소피아는 이미 기대만땅 ㅋ
와우!!!
잘게 부숴진 피스타치오가 올라가 있는 ㅁㅊ 비주얼의 티라미수
시그니처인 브루크
브루돌체
모두 넘 맛있었다는 ㅎㅎ
그제서야 눈에 들어왔던 천장
갑자기 파리 오페라 가르니에가 생각나면서 다시 몽글몽글해 지고...ㅋㅋㅋㅋ
벌써 일년이 되었다니 ㅠㅠ 또 가고싶다 파리
카페에서 나오기 전 화장실에 들어 갔는데
여기가 화장실인지 뮤지엄인지...
화장실 안갔으면 큰일 날 뻔했다 ㅋㅋㅋㅋ
일어나실때 머리조심 👍👍👍
꼭 다시 재방문 하고 싶은 커피와 티라미수 찐맛집 브루크
성수동 예쁜 카페 찾으신다면 추천드려요~
작년 런던 파리 여행 추억해 보기
https://m.blog.naver.com/art2000umin/223265484179
파리여행/오페라 가르니에 파리의 상징 에펠탑
죽기전에 꼭 가봐야 하는 세계 유적지중 하나인 파리 오페라 국립극장 오페라 가르니에로 출발~ 만능 대중...
m.blog.naver.com
https://m.blog.naver.com/art2000umin/223258195801
요크 여행/기차 타고 드디어 작은딸이 있는 요크로~
작은딸이 교환 학생으로 가있는 요크로 가기 위해 우버를 타고 킹스 크로스 기차역으로 갔다 기차역이 워낙...
m.blog.naver.com
#성수동핫플 #성수동꼭가봐야할카페
#건대입구역카페 #성수예쁜카페 #티라미수맛집
#콜드브루전문카페 #유럽풍카페 #커피가맛있는카페","https://postfiles.pstatic.net/MjAyNDEwMjRfMjY3/MDAxNzI5NzYyMzE3ODU2.8kCIgST7TXdzYhvp0F38AK1hKHq5zVhlx1tkcv6dwiIg.7HSYVHGmMlltFkTBJM5IRwm5JmHhRvll24DX5vmgicgg.JPEG/20241024%EF%BC%BF150501.jpg?type=w773, https://postfiles.pstatic.net/MjAyNDEwMjRfMTQ5/MDAxNzI5NzgxMzc3MzU1.BByMFR7jjFgJnpbha6Bxc-WiJtbvAYDXCrtYfvhzA38g.oyGWDyuX4YuAuasfmxmA8eTg0ZYTRKkC8Ur_BV8ws6wg.JPEG/20241024%EF%BC%BF135214.jpg?type=w80_blur, https://postfiles.pstatic.net/MjAyNDEwMjRfMTgg/MDAxNzI5NzYyMzE2MjE0.EFXIF7zyESWWTA3HlSi0gIvBbD00wFfGkZfGPFxh24cg.RDqKDmnaQIaG5sPdpzvcmF7Zn45fgQrhAmjedKom4HIg.JPEG/20241024%EF%BC%BF135220.jpg?type=w80_blur, https://postfiles.pstatic.net/MjAyNDEwMjRfMzYg/MDAxNzI5NzcxMDU2MTI5.2NZ5Ci8okzdA0TQNSU5ok5uXU3I_VV0jQK5ZbufWCFMg.0h1bbU3tmADjSAGvHGLzD2drJt7XI0deJW3q_mDmHdMg.JPEG/1729762353075.jpg?type=w80_blur, https://postfiles.pstatic.net/MjAyNDEwMjRfNjgg/MDAxNzI5NzYyMzIyMjQw.h-lu0ikqxPoDgspsstyQihjcFVIAHlYxqWADOqs6EJUg.aDmvYML4ot_Yv_i8Z6oxos6sSmvtQ--yxn_HFewkVwsg.JPEG/20241024%EF%BC%BF140051.jpg?type=w80_blur, https://postfiles.pstatic.net/MjAyNDEwMjRfMTk5/MDAxNzI5NzYyMzE0ODU2.NhNCWIwNwAyGF__0gSB4Vj558NmQh3Y3SmmxM2Nd56cg.O4sHYfNoZKlzLcxQik4qkre4s5N4NcsS3AxUPRs7_8Ig.JPEG/20241024%EF%BC%BF135226.jpg?type=w80_blur, https://postfiles.pstatic.net/MjAyNDEwMjRfMjQ0/MDAxNzI5NzcxMTIyNzAw.Osf-Imevkd2h5Zru7Q0dCKNRigzRD-GIQwFH6cLTVj0g.acqlpBNJteIwAWrQ576rHHjn-jL__mIEFl6fr7WQrRAg.JPEG/1729771122205.jpg?type=w80_blur, https://postfiles.pstatic.net/MjAyNDEwMjRfMjA4/MDAxNzI5NzYyMzIzNDkz.Qkv56FtqVDFC3JIBpd1OAa-qexohy-ZCYNuLms9RvWwg.QQ30oxITiViY6Q2N4YnlOPqmkfy2GM3gIna8gwEWde8g.JPEG/20241024%EF%BC%BF135245.jpg?type=w80_blur, https://postfiles.pstatic.net/MjAyNDEwMjRfMTcg/MDAxNzI5NzY5NzIwNzc1.y1JjAwkMU0wob_XDiJwj-bD8eSXlZghtY5qazNc1O1gg.T6QlWcPWFWRxuSdNJ5buHHhKlart26HEMkb8zav8Cs8g.JPEG/1729762353216.jpg?type=w80_blur, https://postfiles.pstatic.net/MjAyNDEwMjRfNDgg/MDAxNzI5NzY5NzQ2NjY5.cKl6srtYpCL32W1tLE_qhnGkVxk6hiarZEKWXVF-O_Ig.86bRTto4SpOyZgtdWGIvOGHNlSoTOuv_ShzxuWStOdcg.JPEG/1729762352212.jpg?type=w80_blur, https://postfiles.pstatic.net/MjAyNDEwMjRfMjYx/MDAxNzI5NzYyMzI0MzM1.j5-Aqh7IsK9opf5gtJXHJma54thbECTwKWQhVPtxFl8g.Z-PW5SJbAm9ymqLE_ur_QEbGkdL1dBtufaB60bO-6S4g.JPEG/20241024%EF%BC%BF140100.jpg?type=w80_blur, https://postfiles.pstatic.net/MjAyNDEwMjRfMTE4/MDAxNzI5NzYyMzE2MTg4.cjlW0M7LH6fuhV2dHRx43em20GIOZovB7L7VJkfAbtIg.ybfqH0YvyIjTlJVfWocuHlOHy20-0YQBaPFIykUp2H0g.JPEG/20241024%EF%BC%BF150343.jpg?type=w80_blur, https://postfiles.pstatic.net/MjAyNDEwMjRfMjg0/MDAxNzI5NzYyMzIxMDU5.1IG0mnDk52sY7L3wT8ApZrTTtx6zHhSjZLv1y9UNFpgg.LTxmRzvxnRwOiGPpm9_ZJdwX7LT3xyG7q8s1CjkMNqEg.JPEG/Screenshot%EF%BC%BF20241024%EF%BC%BF175458%EF%BC%BFGallery.jpg?type=w80_blur, https://postfiles.pstatic.net/MjAyNDEwMjRfMjIy/MDAxNzI5Nzc1NDE0MDEw.hbnacs4oy1qv1McQOfOa9lq8tWyTSAHaPTx73p3OoZkg.WRTqncdRiLoZQsOwMhywvbok-YOoXmIUtQbfxmGjWlMg.JPEG/Screenshot%EF%BC%BF20241024%EF%BC%BF175508%EF%BC%BFGallery.jpg?type=w80_blur, https://postfiles.pstatic.net/MjAyNDEwMjRfMTgy/MDAxNzI5NzYzMDA0MzE3.O09LqchW0BRFMZFfT3JU-nvEgqlT19SQul7sOaaTowcg.KN6S4KvRRaqdDQ43JD4e4yCvaHllN1yn2ZalguvgDfkg.JPEG/1729763003500.jpg?type=w80_blur, https://postfiles.pstatic.net/MjAyNDEwMjRfNTEg/MDAxNzI5NzYyMzE4ODk0.-FVYTlCu2ujesli0P_H76awQ6Eiv5XgYUzapurFuK6Ig.QNRKybG9f3eRnF0s8PSvys1-FT0Em6roPdr5UP9aagwg.JPEG/20241024%EF%BC%BF135941.jpg?type=w80_blur, https://postfiles.pstatic.net/MjAyNDEwMjRfMjQw/MDAxNzI5NzYyMzI0NDky.GNK6qVUZREiGI54u444pzKfDOwuOpp01FKDkIF09Nzog.xcc9nIw9dxRfYu7nTL5kDVGJTrXHSoNhbYS2lE1SiFwg.JPEG/20241024%EF%BC%BF135951.jpg?type=w80_blur, https://postfiles.pstatic.net/MjAyNDEwMjRfMjA2/MDAxNzI5NzYyMzE3MTQ2.ch1pgxXZnBY14_8OYhjwJrKK318Y6TJnZgp0dz43sEMg.3yO257zZZva6Q25ffjVJpd3RooAQIaFuOqR56n9Npp8g.JPEG/20241024%EF%BC%BF135946.jpg?type=w80_blur, https://postfiles.pstatic.net/MjAyNDEwMjRfODUg/MDAxNzI5NzYyMzE5NDM3.Mwt6R96WkgK6i2Q4aH4Ox2IpXp66xw8KYV7SEkrhqzAg.slBdT1R4pOHVE_UxsXOUYuCv90pW9a2Dk6qu8y1hE5Mg.JPEG/20241024%EF%BC%BF141409.jpg?type=w80_blur, https://postfiles.pstatic.net/MjAyNDEwMjRfMTk5/MDAxNzI5NzYyMzE2MTQz.QvFCnYQVhBod_nULymEKKkPzwHXJUXKO4yKN34_uAFwg.T46L1w1sGsKb5DvXCtr36qCVNWQeoQAyUkxzb9kmClkg.JPEG/20241024%EF%BC%BF142244.jpg?type=w80_blur, https://postfiles.pstatic.net/MjAyNDEwMjRfMTE2/MDAxNzI5NzYyMzE5ODIz.RhLN2L7BXXg0VUBtXqzcciJ8LopvfDvcSaedkxaughUg.TQeAUV0Vw6t_8a6Ln6PzycY6NJ1kQW7ZpQ86qxYRH4Ug.JPEG/20241024%EF%BC%BF142334.jpg?type=w80_blur, https://postfiles.pstatic.net/MjAyNDEwMjRfMTg5/MDAxNzI5NzYyMzIxMTY1.lOp8ztePg-TPU0B5MOCFuqXooyIDCSXQK2PK4CwkNl0g.B3hXzyx5OZU_6D_qhfE5tmLsiERNUVyitOTgjuN2yOEg.JPEG/20241024%EF%BC%BF142241.jpg?type=w80_blur, https://postfiles.pstatic.net/MjAyNDEwMjRfMTgg/MDAxNzI5NzcxMjEwNjc5.52n5v0b3eeWldkHt1-zwivA10mO6TdlwMy3r4lIsFv0g.fK1_B-g8VNqMa3rOXr3sazG8mreKObCEH3X_o8fKz_4g.JPEG/1729771210245.jpg?type=w80_blur, https://postfiles.pstatic.net/MjAyNDEwMjNfMjI1/MDAxNzI5NjgxNjQ3OTE2.oRDlfPhvNDouV55ilLbj1bZUcBLgerPCEUNh4uI-Umsg.0PBUQd_fwCyBpWmIKlitObFTNTT4fOYtdviZMVUJ7pQg.JPEG/20241022%EF%BC%BF133058.jpg?type=w80_blur, https://postfiles.pstatic.net/MjAyNDEwMjNfMTQ0/MDAxNzI5NjgxNjQ5ODAz.Av3_gUwBrtEDnLswl1f-iZ2I0CUUF3_jFnb-HRKtwZYg.QH3s7KEpSGldZu1_i5NrOI5VSyBUpxBR5-Qm23xMuq0g.JPEG/20241022%EF%BC%BF123356.jpg?type=w80_blur, https://postfiles.pstatic.net/MjAyNDEwMjNfMTgy/MDAxNzI5NjgxODg0MjY5.6-32QOK3ozaq11CDyg9Ok3kR8rXCW7TJGljtn-r4FF4g.V_SM0ljuK6UgjyGb2is28iiHGn4JPu8VCrQRw3JfRmcg.JPEG/1729681883586.jpg?type=w80_blur, https://postfiles.pstatic.net/MjAyNDEwMjNfMjQy/MDAxNzI5NjgxNjUwNDY3.vcGBwwX59-U2Rxabyd0xiY0bD4wObutc3o4_oL587gkg.wlunWHAlKmb7DcfwKFj7dw5Xb4hJFGZNE2Gp87nMjUsg.JPEG/20241022%EF%BC%BF125102.jpg?type=w80_blur, https://postfiles.pstatic.net/MjAyNDEwMjNfMjQ0/MDAxNzI5NjgxNjQ4OTM0.KU9kFhCwsvucR1vqNM4MiBYg8AmwW5RhLIi2C4SWzDYg.OoLQTgop797kTq4fL2FWSDWbWi860ivwMfabjK5C6ekg.JPEG/20241023%EF%BC%BF095533.jpg?type=w80_blur, https://postfiles.pstatic.net/MjAyNDEwMjNfMTQ3/MDAxNzI5NjgxNjQ4NDUw.YRFy83ss-PfiToPq5_IEYFxrocop163nbOxtZ1l6Ygog.eVcK7pJPxCOXcSeer16lOexc3d4A6WazLxybfhuNBrwg.JPEG/20241023%EF%BC%BF095522.jpg?type=w80_blur, https://postfiles.pstatic.net/MjAyNDEwMjNfMjAw/MDAxNzI5NjgxNjUwNzE2.ANF7myi_ka4GY__7Ik_myunZXV8x22c__TRI9grZioIg.pvTrQQ-JjMaJQhYEmo550ZfkBu617w-24lzSzyGyIesg.JPEG/20241022%EF%BC%BF200311.jpg?type=w80_blur, https://postfiles.pstatic.net/MjAyNDEwMjNfMjYw/MDAxNzI5NjgxNjUxNTI5.Yd8vAo2icMqNl4q64yEjSxK3gPxAWJ0toMPnCP0KMbQg.goLwyvZCwYZr-P0rxNhMsLmSOzf1ZHSLFX-I8yQGULwg.JPEG/20241023%EF%BC%BF095513.jpg?type=w80_blur, https://postfiles.pstatic.net/MjAyNDEwMjNfMjAw/MDAxNzI5NjgxNjQ5MzQ1.OO5D-ZJbyY_-xwPxgbKeJLa_irPfKypPxTpJ1csrPeYg._xp6Ku6uJfTA122lTmwG6V0eJI_rMKxtzq71__S_C4wg.JPEG/20241023%EF%BC%BF095505.jpg?type=w80_blur, https://postfiles.pstatic.net/MjAyNDEwMjNfMjE4/MDAxNzI5NjgxNzA0NTgy.Dh7FRDeX5O-27TMZVun3whPNao8ltMBwRRd_J55QxBog.XV98GGNBZ2iyhU6QT84lrS4zb8TGwTW2mqy1-WgpxZcg.JPEG/1729681703758.jpg?type=w80_blur, https://postfiles.pstatic.net/MjAyNDEwMjNfMjUx/MDAxNzI5NjgxNjUzMjQx.DEUQfkN2Jg5yZuyy4c_WB3if7DmJ4RunGr17sFtJwT8g.4DYffjqrcVfojX8bsctQ15_Y8bmKrtpHwNcSQsd3ypAg.JPEG/20241023%EF%BC%BF100632.jpg?type=w80_blur, https://postfiles.pstatic.net/MjAyNDEwMjNfMjE1/MDAxNzI5NjY5NjY5MjY4.Kdp6fNymffZcX0QXE834kloqlAGMwD9Mknv6_lKmAAwg.AFjOWMY3PL0bXeubxKHWkF3ASQujED_cjtqw1P-ldLMg.JPEG/20241023%EF%BC%BF133852.jpg?type=w80_blur, https://postfiles.pstatic.net/MjAyNDEwMjNfMjY3/MDAxNzI5NjY5NjcyMzA1.q0V7_4o6wsRcWtpjWlaZ4twvLswYM19fXoRwy1KLOn4g.PRrzKU_VzEn_BSZTBzwLNwtuup7QkBYfv_lSX4tM-GUg.JPEG/20241023%EF%BC%BF133904.jpg?type=w80_blur, https://postfiles.pstatic.net/MjAyNDEwMjNfMjIy/MDAxNzI5NjY5OTAyMzc2._hIRyeETzNZ-tJpTbeDQCpmcMCU9YJ4ZA9XpPxos-5og.KPtUX4PefsRL7PpUOHjk1OB_-T7O6dPqm3_3X96bGJ8g.JPEG/1729669901889.jpg?type=w80_blur, https://postfiles.pstatic.net/MjAyNDEwMjNfNjcg/MDAxNzI5NjY5NjczNTk1.UHUwn9YJN8B3IiABdIshY78PsIJnfzGgnUb3lBObJLIg.JNJ_PSaJwazuL7glUZuf30_J3muPmDyGFX9xInZNzbEg.JPEG/20241023%EF%BC%BF115701.jpg?type=w80_blur, https://postfiles.pstatic.net/MjAyNDEwMjNfMTM3/MDAxNzI5NjY5Njc1MzU2.EzprV1fB5e8AP9pY2uUMkIOmelUq2xZdn4M9K5nOU4sg.E6SOK_pLlivO6R5heSBGW19dag0OKuwXLGgeUJNbkxAg.JPEG/20241023%EF%BC%BF115710.jpg?type=w80_blur, https://postfiles.pstatic.net/MjAyNDEwMjNfMjA3/MDAxNzI5NjY5NjczNDc4.EAUnlXc2-mHIKNp7keilqstjRIavzas1U9VbKfOLZOEg.p0BvSB5PFoqERAU8mR8BKeNomWmS9n0cOJvirx0Nl9Yg.JPEG/20241023%EF%BC%BF115639.jpg?type=w80_blur, https://postfiles.pstatic.net/MjAyNDEwMjNfMTAy/MDAxNzI5NjY5NjcxNTY5.P2KLZxki9NzXqdhr5rfb8Px50wSFfylSLDEpMSPlmjUg.HrwTmkd7gpOM26zQFTZpN0pbmB2nMt0RSwV8AxcfZLkg.JPEG/20241023%EF%BC%BF115614.jpg?type=w80_blur, https://postfiles.pstatic.net/MjAyNDEwMjNfMTk0/MDAxNzI5NjY5NjcyNDgy.2qInllAflXiruI5thVG_iQMWNdjZiobIfz_qSi8vgo4g.uuu7_SdPTZO4ai7RqpwRMc0nfHYcJFXiA7dTHDwWe10g.JPEG/20241023%EF%BC%BF115855.jpg?type=w80_blur, https://postfiles.pstatic.net/MjAyNDEwMjNfMjcz/MDAxNzI5NjY5NjY5ODQ0.Y4G2cY0nQGrc5zTc5yUPTBBHkOPDfezGwiGJ6SCTd5wg.0qxV83MykQg9LPypMHcyYSsMua_uwdGSzLz9OiUBiqwg.JPEG/20241023%EF%BC%BF120302.jpg?type=w80_blur, https://postfiles.pstatic.net/MjAyNDEwMjNfMTE3/MDAxNzI5NjY5NjcwMDkx.P--xdyd3DZsxkj8GOXTn0QXdSF7Tg6sOpxajItIFGmAg.Ie0-AxCfIpPrYrD-28z2ZMU3ixHWjv-KeQSFs3UWf8cg.JPEG/20241023%EF%BC%BF115916.jpg?type=w80_blur, https://postfiles.pstatic.net/MjAyNDEwMjNfMjM4/MDAxNzI5NjY5NjczMzUx.TDpiJnzBRaULAIHHePyEmudvsCI4kfjyfbBpjfHHw4Qg.Tkig6xVROvQgCUcXb4pp2QY8k2HSPnI_OBORwG04M6kg.JPEG/20241023%EF%BC%BF115910.jpg?type=w80_blur, https://postfiles.pstatic.net/MjAyNDEwMjNfMTYz/MDAxNzI5NjY5NzcyMTA1.1j1uvnbfpl2ONAqJ4uBcsXwiGLYVao0bnlHRMtl4VHkg.AG5nYsvKJW2yvQJuFQ9VGSPR1u31sX6dNq5iqIa5K34g.JPEG/1729669771383.jpg?type=w80_blur, https://postfiles.pstatic.net/MjAyNDEwMjNfMjIx/MDAxNzI5NjY5NjY5MTI0.NvWdbuO41rX7n_4Y_fIaWKg5kurBfC0d5TJwIx1BkxUg.U1ISO5q33dVHqPTc4jvnH83QHNkP_CG7Bh8Ww38iy5cg.JPEG/20241023%EF%BC%BF120709.jpg?type=w80_blur, https://postfiles.pstatic.net/MjAyNDEwMjNfNCAg/MDAxNzI5NjY5NjcwOTA3.oRwvWmja7TXAQEcybKxdXJSt3sJf8-YLiooWuwOZ3a8g.gHdrnLWIMqFkHU9dpRHRAurw0hLHAQkoZM_8EPbruNAg.JPEG/20241023%EF%BC%BF124327.jpg?type=w80_blur, https://postfiles.pstatic.net/MjAyNDEwMjNfMTgx/MDAxNzI5NjY5NjcxMDQx.XFSn7PFv1RnD2dCjA98IV-YwlC49v4tR05X6y6xNsMMg.w_tjd5RAzfSajnBgni_kiQ9LmcvgNKNhsvpDvtSKLT4g.JPEG/20241023%EF%BC%BF124339.jpg?type=w80_blur, https://postfiles.pstatic.net/MjAyNDEwMjNfMjcz/MDAxNzI5NjY5Njc0MTA1.Qsc-HBPRSel0EFx_rsqhrs02W6ia-nyBfLL5PdZYvZYg.TyF6vqrPq1tQcjxbRjobkQXE6dBUcw_lEd4GvqmzU1wg.JPEG/20241023%EF%BC%BF125004.jpg?type=w80_blur, https://postfiles.pstatic.net/MjAyNDEwMjNfMjAx/MDAxNzI5NjY5NjczNDMx.avuDdaMHdQ6aTLLPinOLR4dWLiQHRhlYB2r6nbFl268g.eWzO2VYKoenXhQKRtcjaIOF0Gr1-lsktJlLFQaiN26Ag.JPEG/20241023%EF%BC%BF125016.jpg?type=w80_blur, https://postfiles.pstatic.net/MjAyNDEwMjNfMTE4/MDAxNzI5NjY5NjY5MTM5.rlIUfS89EAz5DcUPJ9QPjgpKMoW5jHRXZ4PVzkIm4r0g.vbBe_d9GS_IjwugjzMGbhuHkz98aOq2Kcplwy7JOmZQg.JPEG/20241023%EF%BC%BF125051.jpg?type=w80_blur, https://postfiles.pstatic.net/MjAyNDEwMjNfMTA1/MDAxNzI5NjY5NjcyMDcz.pdsudk5fSBOUxNOv-5ig9JBjHkKZRNve0OsqwKuCNPsg.hduStnRzneICprIuVPVEOmtLOVpQLW5Uq6iamSFeMTEg.JPEG/1729667212516.jpg?type=w80_blur, https://postfiles.pstatic.net/MjAyNDEwMjNfMTAy/MDAxNzI5NjY5NjcwOTc3.70H5MgauGZpGLceiVTinJRzE-rfcipn9WXkVfE5r8skg.NhRnQWlh3QohSnOrtAAFb9oWdCeLznNxdHSnhZDE0Csg.JPEG/20241023%EF%BC%BF125224.jpg?type=w80_blur, https://postfiles.pstatic.net/MjAyNDEwMjNfMTA1/MDAxNzI5NjY5NjcwNDc4.d3LNa8YRZyFgJhwJqtkQnd9MtZDIrtlV2tJmAecrIn8g.JjjG5e9TztsBZ7ysFt0LUqu2g0ikC6JOuCw9tdTdfAQg.JPEG/20241023%EF%BC%BF132006.jpg?type=w80_blur, https://postfiles.pstatic.net/MjAyNDEwMjNfMTYz/MDAxNzI5NjY5Njc0ODk4.LDgROZk1KljNnVzP6Rxefb_6H8wnGYe_SC8Pcblx3LAg.wGpJDmOeFBVKXYV0hJdLwIamwC4fPPH2F61iizbt3p8g.JPEG/1729667216176.jpg?type=w80_blur, https://postfiles.pstatic.net/MjAyNDEwMjNfMjQ4/MDAxNzI5NjY5Njc0NDM3.q6kvC1WcsU1HlSytRRZPkJ-ko0Rjl0lCwK4raWI1ctUg.xYvfnVNVk5TnkRanPKfLuWImBUGaHoLyDSYg4tlrTkUg.JPEG/1729667221255.jpg?type=w80_blur, https://postfiles.pstatic.net/MjAyNDEwMjNfMTcy/MDAxNzI5NjY5NjcyMjI0.L-lZ6Hk2bRm5L6dqXdrTK1toI5XG-CJzsi9rfkAjeXcg.uGYCTvPEmkdwrTZ7hZr_5L7PFqRdBEesBgAZ0UmmmPMg.JPEG/20241023%EF%BC%BF133954.jpg?type=w80_blur, https://postfiles.pstatic.net/MjAyNDEwMjNfMjM2/MDAxNzI5NjY5Njc1OTA0.hzthioQ9mRpjPB7loVWwEGaCCQxLbF4mZQVmCE-SIP8g.nZvCyA6sDk3zrEvNuxNtP8p56q2InccfV_VjVBMfut0g.JPEG/20241023%EF%BC%BF115218.jpg?type=w80_blur, https://postfiles.pstatic.net/MjAyNDEwMjNfMjAz/MDAxNzI5NjY5Njc0ODU1.JAoEtwYbDBrj7puKeM-Yoeiy5YfkaVunxp3mpzhD0eAg.MkRo8QO_mhUsRavHXOQDgTp7SjIdDdDaF80tsFgfXDgg.JPEG/20241023%EF%BC%BF115233.jpg?type=w80_blur",,
